<?xml version="1.0" encoding="UTF-8" ?>
<xs:schema
	attributeFormDefault="unqualified"
	elementFormDefault="qualified"
	targetNamespace="http://localhost/easy-in"
	xmlns:xs="http://www.w3.org/2001/XMLSchema">
	<xs:element name="data">
		<xs:complexType>
			<xs:sequence>
				<xs:element name="items">
					<xs:complexType>
						<xs:sequence>
							<xs:element name="item" maxOccurs="unbounded" minOccurs="0">
								<xs:complexType>
									<xs:simpleContent>
										<xs:extension base="xs:string">
											<xs:attribute type="xs:string" name="firstName" use="optional"/>
											<xs:attribute type="xs:string" name="lastName" use="optional"/>
											<xs:attribute type="xs:string" name="street" use="optional"/>
											<xs:attribute type="xs:string" name="cityCode" use="optional"/>
											<xs:attribute type="xs:string" name="countryCode" use="optional"/>
										</xs:extension>
									</xs:simpleContent>
								</xs:complexType>
							</xs:element>
						</xs:sequence>
					</xs:complexType>
				</xs:element>
				<xs:element name="cities">
					<xs:complexType>
						<xs:sequence>
							<xs:element name="city" maxOccurs="unbounded" minOccurs="0">
								<xs:complexType>
									<xs:simpleContent>
										<xs:extension base="xs:string">
											<xs:attribute type="xs:string" name="code"/>
										</xs:extension>
									</xs:simpleContent>
								</xs:complexType>
							</xs:element>
						</xs:sequence>
					</xs:complexType>
				</xs:element>
				<xs:element name="countries">
					<xs:complexType>
						<xs:sequence>
							<xs:element name="country" maxOccurs="unbounded" minOccurs="0">
								<xs:complexType>
									<xs:simpleContent>
										<xs:extension base="xs:string">
											<xs:attribute type="xs:string" name="code"/>
											<xs:attribute type="xs:string" name="name"/>
										</xs:extension>
									</xs:simpleContent>
								</xs:complexType>
							</xs:element>
						</xs:sequence>
					</xs:complexType>
				</xs:element>
			</xs:sequence>
		</xs:complexType>
	</xs:element>
</xs:schema>
